"Gallic (a.) Pertaining to, or derived from, galls, nutgalls, and the like."

Gallic (a.) Pertaining to Gaul or France; Gallican.

"Gallican (a.) Of or pertaining to Gaul or France; Gallic; French; as, the Gallican church or clergy."

"Gallican (n.) An adherent to, and supporter of, Gallicanism."

"Gallicanism (n.) The principles, tendencies, or action of those, within the Roman Catholic Church in France, who (esp. in 1682) sought to restrict the papal authority in that country and increase the power of the national church."

"Gallicism (n.) A mode of speech peculiar to the French; a French idiom; also, in general, a French mode or custom."

Gallicized (imp. & p. p.) of Gallicize

Gallicizing (p. pr. & vb. n.) of Gallicize

Gallicize (v. t.) To conform to the French mode or idiom.

Gallied (p. p. & a.) Worried; flurried; frightened.

Galliform (a.) Like the Gallinae (or Galliformes) in structure.

Galligaskins (n. pl.) Loose hose or breeches; leather leg quards. The word is used loosely and often in a jocose sense.

Gallimatia (n.) Senseless talk. [Obs. or R.] See Galimatias.

Gallimaufries (pl. ) of Gallimaufry

"Gallimaufry (n.) A hash of various kinds of meats, a ragout."

Gallimaufry (n.) Any absurd medley; a hotchpotch.

Gallin (n.) A substance obtained by the reduction of gallein.

Gallinaceae (n. pl.) Same as Gallinae.

Gallinacean (n.) One of the Gallinae or gallinaceous birds.

Gallinaceous (a.) Resembling the domestic fowls and pheasants; of or pertaining to the Gallinae.

"Gallinae (n.) An order of birds, including the common domestic fowls, pheasants, grouse, quails, and allied forms; -- sometimes called Rasores."

Galling (a.) Fitted to gall or chafe; vexing; harassing; irritating.

Gallinipper (n.) A large mosquito.

"Gallinule (n.) One of several wading birds, having long, webless toes, and a frontal shield, belonging to the family Rallidae. They are remarkable for running rapidly over marshes and on floating plants. The purple gallinule of America is Ionornis Martinica, that of the Old World is Porphyrio porphyrio. The common European gallinule (Gallinula chloropus) is also called moor hen, water hen, water rail, moor coot, night bird, and erroneously dabchick. Closely related to it is the Florida gallinule (Gallinula galeata)."

Galliot (n.) See Galiot.

"Gallipoli oil () An inferior kind of olive oil, brought from Gallipoli, in Italy."

"Gallipot (n.) A glazed earthen pot or vessel, used by druggists and apothecaries for containing medicines, etc."

"Gallium (n.) A rare metallic element, found in certain zinc ores. It is white, hard, and malleable, resembling aluminium, and remarcable for its low melting point (86/ F., 30/C). Symbol Ga. Atomic weight 69.9."

"Gallivant (v. i.) To play the beau; to wait upon the ladies; also, to roam about for pleasure without any definite plan."

"Gallivat (n.) A small armed vessel, with sails and oars, -- used on the Malabar coast."

"Galliwasp (n.) A West Indian lizard (Celestus occiduus), about a foot long, imagined by the natives to be venomous."

"Gallnut (n.) A round gall produced on the leaves and shoots of various species of the oak tree. See Gall, and Nutgall."

Gallomania (n.) An excessive admiration of what is French.

"Gallon (n.) A measure of capacity, containing four quarts; -- used, for the most part, in liquid measure, but sometimes in dry measure."

"Galloon (n.) A narrow tapelike fabric used for binding hats, shoes, etc., -- sometimes made ornamental."

"Galloon (n.) A similar bordering or binding of rich material, such as gold lace."

Gallooned (a.) Furnished or adorned with galloon.

Galloped (imp. & p. p.) of Gallop

Galloping (p. pr. & vb. n.) of Gallop

Gallop (v. i.) To move or run in the mode called a gallop; as a horse; to go at a gallop; to run or move with speed.

Gallop (v. i.) To ride a horse at a gallop.

"Gallop (v. i.) Fig.: To go rapidly or carelessly, as in making a hasty examination."

Gallop (v. t.) To cause to gallop.

"Gallop (v. i.) A mode of running by a quadruped, particularly by a horse, by lifting alternately the fore feet and the hind feet, in successive leaps or bounds."

"Gallopade (n.) I horsemanship, a sidelong or curveting kind of gallop."

"Gallopade (n.) A kind of dance; also, music to the dance; a galop."

Gallopaded (imp. & p. p.) of Gallopade

Gallopading (p. pr. & vb. n.) of Gallopade

"Gallopade (v. i.) To gallop, as on horseback."

Gallopade (v. i.) To perform the dance called gallopade.

"Galloper (n.) One who, or that which, gallops."

"Galloper (n.) A carriage on which very small guns were formerly mounted, the gun resting on the shafts, without a limber."

Gallopin (v. i.) An under servant for the kitchen; a scullion; a cook's errand boy.

"Galloping (a.) Going at a gallop; progressing rapidly; as, a galloping horse."

Gallotannic (a.) Pertaining to the tannin or nutgalls.

"Gallow (v. t.) To fright or terrify. See Gally, v. t."

"Galloway (n.) A small horse of a breed raised at Galloway, Scotland; -- called also garran, and garron."

Gallowglass (n.) A heavy-armed foot soldier from Ireland and the Western Isles in the time of Edward /

Gallowses (pl. ) of Gallows

Gallows (pl. ) of Gallows

"Gallows (n. sing.) A frame from which is suspended the rope with which criminals are executed by hanging, usually consisting of two upright posts and a crossbeam on the top; also, a like frame for suspending anything."

Gallows (n. sing.) A wretch who deserves the gallows.

Gallows (n. sing.) The rest for the tympan when raised.

Gallows (n. sing.) A pair of suspenders or braces.

"Gallstone (n.) A concretion, or calculus, formed in the gall bladder or biliary passages. See Calculus, n., 1."

Gally (v. t.) To frighten; to worry.

Gally (a.) Like gall; bitter as gall.

"Gally (n.) See Galley, n., 4."

Gallygaskins (n. pl.) See Galligaskins.

Galoche () Alt. of Galoshe

Galoshe () A clog or patten.

Galoshe () Hence: An overshoe worn in wet weather.

"Galoshe () A gaiter, or legging, covering the upper part of the shoe and part of the leg."

"Galoot (n.) A noisy, swaggering, or worthless fellow; a rowdy."

"Galop (n.) A kind of lively dance, in 2-4 time; also, the music to the dance."

Galore (n. & a.) Plenty; abundance; in abundance.

Galoshe (n.) Same as Galoche.

"Galpe (v. i.) To gape,; to yawn."

Galsome (a.) Angry; malignant.

Galt (n.) Same as Gault.

"Galvanic (a.) Of or pertaining to, or exhibiting the phenomena of, galvanism; employing or producing electrical currents."

Galvanism (n.) Electricity excited by the mutual action of certain liquids and metals; dynamical electricity.

"Galvanism (n.) The branch of physical science wh