Sadiron (n.) An iron for smoothing clothes; a flatiron.

Sadly (adv.) Wearily; heavily; firmly.

Sadly (adv.) Seriously; soberly; gravely.

Sadly (adv.) Grievously; deeply; sorrowfully; miserably.

Sadness (n.) Heaviness; firmness.

Sadness (n.) Seriousness; gravity; discretion.

"Sadness (n.) Quality of being sad, or unhappy; gloominess; sorrowfulness; dejection."

"Sadr (n.) A plant of the genus Ziziphus (Z. lotus); -- so called by the Arabs of Barbary, who use its berries for food. See Lotus (b)."

Saengerfest (n.) A festival of singers; a German singing festival.

"Safe (superl.) Free from harm, injury, or risk; untouched or unthreatened by danger or injury; unharmed; unhurt; secure; whole; as, safe from disease; safe from storms; safe from foes."

"Safe (superl.) Conferring safety; securing from harm; not exposing to danger; confining securely; to be relied upon; not dangerous; as, a safe harbor; a safe bridge, etc."

"Safe (superl.) Incapable of doing harm; no longer dangerous; in secure care or custody; as, the prisoner is safe."

Safe (n.) A place for keeping things in safety.

"Safe (n.) A strong and fireproof receptacle (as a movable chest of steel, etc., or a closet or vault of brickwork) for containing money, valuable papers, or the like."

Safe (n.) A ventilated or refrigerated chest or closet for securing provisions from noxious animals or insects.

Safe (v. t.) To render safe; to make right.

Safe-conduct (n.) That which gives a safe passage

Safe-conduct (n.) a convoy or guard to protect a person in an enemy's country or a foreign country

"Safe-conduct (n.) a writing, pass, or warrant of security, given to a person to enable him to travel with safety."

Safe-conduct (v. t.) To conduct safely; to give safe-conduct to.

"Safeguard (n.) One who, or that which, defends or protects; defense; protection."

Safeguard (n.) A convoy or guard to protect a traveler or property.

Safeguard (n.) A pass; a passport; a safe-conduct.

Safeguard (v. t.) To guard; to protect.

Safe-keeping (n.) The act of keeping or preserving in safety from injury or from escape; care; custody.

"Safely (adv.) In a safe manner; danger, injury, loss, or evil consequences."

"Safeness (n.) The quality or state of being safe; freedom from hazard, danger, harm, or loss; safety; security; as the safeness of an experiment, of a journey, or of a possession."

Safe-pledge (n.) A surety for the appearance of a person at a given time.

"Safety (n.) The condition or state of being safe; freedom from danger or hazard; exemption from hurt, injury, or loss."

"Safety (n.) Freedom from whatever exposes one to danger or from liability to cause danger or harm; safeness; hence, the quality of making safe or secure, or of giving confidence, justifying trust, insuring against harm or loss, etc."

Safety (n.) Preservation from escape; close custody.

"Safety (n.) Same as Safety touchdown, below."

Safflow (n.) The safflower.

"Safflower (n.) An annual composite plant (Carthamus tinctorius), the flowers of which are used as a dyestuff and in making rouge; bastard, or false, saffron."

Safflower (n.) The dried flowers of the Carthamus tinctorius.

Safflower (n.) A dyestuff from these flowers. See Safranin (b).

Saffron (n.) A bulbous iridaceous plant (Crocus sativus) having blue flowers with large yellow stigmas. See Crocus.

"Saffron (n.) The aromatic, pungent, dried stigmas, usually with part of the stile, of the Crocus sativus. Saffron is used in cookery, and in coloring confectionery, liquors, varnishes, etc., and was formerly much used in medicine."

"Saffron (n.) An orange or deep yellow color, like that of the stigmas of the Crocus sativus."

"Saffron (a.) Having the color of the stigmas of saffron flowers; deep orange-yellow; as, a saffron face; a saffron streamer."

"Saffron (v. t.) To give color and flavor to, as by means of saffron; to spice."

Saffrony (a.) Having a color somewhat like saffron; yellowish.

Safranin (n.) An orange-red dyestuff extracted from the saffron.

"Safranin (n.) A red dyestuff extracted from the safflower, and formerly used in dyeing wool, silk, and cotton pink and scarlet; -- called also Spanish red, China lake, and carthamin."

"Safranin (n.) An orange-red dyestuff prepared from certain nitro compounds of creosol, and used as a substitute for the safflower dye."

"Safranine (n.) An orange-red nitrogenous dyestuff produced artificially by oxidizing certain aniline derivatives, and used in dyeing silk and wool; also, any one of the series of which safranine proper is the type."

Sagged (imp. & p. p.) of Sag

Sagging (p. pr. & vb. n.) of Sag

"Sag (v. i.) To sink, in the middle, by its weight or under applied pressure, below a horizontal line or plane; as, a line or cable supported by its ends sags, though tightly drawn; the floor of a room sags; hence, to lean, give way, or settle from a vertical position; as, a building may sag one way or another; a door sags on its hinges."

"Sag (v. i.) Fig.: To lose firmness or elasticity; to sink; to droop; to flag; to bend; to yield, as the mind or spirits, under the pressure of care, trouble, doubt, or the like; to be unsettled or unbalanced."

Sag (v. i.) To loiter in walking; to idle along; to drag or droop heavily.

Sag (v. t.) To cause to bend or give way; to load.

Sag (n.) State of sinking or bending; sagging.

Sagas (pl. ) of Saga

"Saga (n.) A Scandinavian legend, or heroic or mythic tradition, among the Norsemen and kindred people; a northern European popular historical or religious tale of olden time."

Sagacious (a.) Of quick sense perceptions; keen-scented; skilled in following a trail.

"Sagacious (a.) Hence, of quick intellectual perceptions; of keen penetration and judgment; discerning and judicious; knowing; far-sighted; shrewd; sage; wise; as, a sagacious man; a sagacious remark."

Sagacity (n.) The quality of being sagacious; quickness or acuteness of sense perceptions; keenness of discernment or penetration with soundness of judgment; shrewdness.

"Sagamore (n.) The head of a tribe among the American Indians; a chief; -- generally used as synonymous with sachem, but some writters distinguished between them, making the sachem a chief of the first rank, and a sagamore one of the second rank."

Sagamore (n.) A juice used in medicine.

Sagapen (n.) Sagapenum.

"Sagapenum (n.) A fetid gum resin obtained from a species of Ferula. It has been used in hysteria, etc., but is now seldom met with."

"Sagathy (n.) A mixed woven fabric of silk and cotton, or silk and wool; sayette; also, a light woolen fabric."

"Sage (n.) A suffruticose labiate plant (Salvia officinalis) with grayish green foliage, much used in